{
  "$schema": "./workflow.schema.json",
  "name": "beat_to_prompts",
  "version": 1,
  "description": "Beat id to validated shot plan with compiled image and video prompts. Stages 1-7 of pipeline.md. Cost-bearing render nodes live in beat_to_media.json.",
  "config": {
    "rag_corpus": "projects/canonflow-agentic-cinema/locations/us-central1/ragCorpora/6103899219179864064",
    "model_reasoning": "gemini-3.1-pro-preview",
    "model_bulk": "gemini-3.7-flash",
    "negatives": [
      "on-screen text",
      "watermarks",
      "modern logos",
      "extra fingers"
    ],
    "character_map": {
      "Demian": "gs://canonflow-agentic-cinema-rag-corpus/reference-images/r4/demian.jpg",
      "Y.D.": "gs://canonflow-agentic-cinema-rag-corpus/reference-images/r4/yd.jpg"
    }
  },
  "inputs": {
    "beat_id": {
      "type": "string",
      "required": true
    },
    "beat_text": {
      "type": "string",
      "required": true
    }
  },
  "nodes": [
    {
      "id": "ctx_canon",
      "kind": "rag.retrieve",
      "label": "Context Broker - canon and continuity",
      "params": {
        "corpus": "${config.rag_corpus}",
        "query": "Canon constraints, characters, locations and continuity for beat ${input.beat_id}: ${input.beat_text}",
        "top_k": 12,
        "distance_threshold": 0.6
      }
    },
    {
      "id": "ctx_grammar",
      "kind": "rag.retrieve",
      "label": "Context Broker - visual grammar",
      "params": {
        "corpus": "${config.rag_corpus}",
        "query": "Established camera grammar, lens choices, lighting and colour palette for beat ${input.beat_id}",
        "top_k": 8,
        "distance_threshold": 0.6
      }
    },
    {
      "id": "ctx_state",
      "kind": "mcp.query",
      "label": "Context Broker - ClickHouse beat state",
      "params": {
        "sql": "SELECT beat_id, status, updated_at FROM canonflow.beat_state WHERE beat_id = '${input.beat_id}' LIMIT 1"
      },
      "on_error": "continue",
      "on_error_output": {
        "sql": "",
        "text": "(no persisted state)"
      }
    },
    {
      "id": "packets",
      "kind": "python.fn",
      "params": {
        "target": "canonflow_agent.flow.packets:bind_packets",
        "args": {
          "beat_id": "${input.beat_id}"
        }
      }
    },
    {
      "id": "decompose",
      "kind": "model.json",
      "label": "Scene Decomposer",
      "params": {
        "model": "${config.model_reasoning}",
        "thinking_level": "HIGH",
        "temperature": 0.6,
        "max_output_tokens": 65536,
        "system": "You are the Scene Decomposer for a feature film pipeline. Decide how many scenes and shots this beat needs from its dramatic content alone. A dense action beat may need many shots; a held two-hander may need two. Never target a fixed number. Return JSON only.\n\nHARD CONSTRAINT - shot duration:\n- Default renderer is gemini-omni-1.1-flash, which bills per token and accepts\n  any integer duration. duration_s must be an integer from 1 to 10 seconds\n  (MAXIMUM_SHOT_DURATION_SECONDS = 10, evidence 64 runtime_contract).\n- If shot_context.bound is true, duration_s is dictated per shot by\n  shot_context.shots[].duration_s. Reproduce it exactly, including odd values\n  such as 7 or 9. It is not negotiable and not roundable.\n- hero_render=true routes the shot to Veo 3.1, which only supports 4, 6 or 8\n  seconds. Set hero_render=true only for a shot that genuinely needs Veo\n  quality AND whose duration is 4, 6 or 8. For every bound shot whose duration\n  is not 4, 6 or 8, hero_render MUST be false.\n\n\n=== MARK: SHOT SKELETON BINDING (evidence-64) ===\nshot_context is provided as input. If shot_context.bound is true it is\nAUTHORITATIVE: reproduce shot_count, scene_order, and per-shot duration_s,\nframing, movement and lens_intent EXACTLY as given. Do not add, drop, merge or\nresize shots. Generate only blocking, dialogue and prompt content.\nIf shot_context.bound is false, derive the decomposition yourself, but pick\nframing/movement/lens_intent only as a complete triple from\nshot_context.camera_vocabulary.\n\n=== MARK: BEAT BOUNDARY ===\nOnly the supplied beat_text is in scope. Content listed in\nneighbour_exclusions belongs to adjacent beats and MUST NOT appear here -\nnot as dialogue, not as blocking, not as SFX, not as a lighting state.\nDo not pre-stage a later beat's action and do not repeat an earlier beat's\nalready-consumed action or sound event.\n\n=== MARK: DIALOGUE AUTHORITY ===\nQuoted lines inside beat_text are canon-explicit: use them verbatim, assign\nthem to the shot whose action they accompany, and never split a quoted line\nacross two shots. Where the beat specifies only intent (\"she reminds him of\",\n\"reciting a riddle about\") without wording, you MAY author a line; mark every\nsuch line with \"fact_classification\": \"proposal\". Never author a line for a\nbeat whose performance direction is silence, and never author a line for a\ncharacter absent from the beat's participating characters.\n\n=== MARK: STAGING MANDATES ===\nThe beat's \"Production or staging considerations\" and \"Y.D. state and voice\nstage\" are binding constraints, not suggestions. Camera stillness/motion,\nlighting exclusivity (\"lit only by\"), POV mode, and named framing mandates\noverride your own preference.\n\n\n## NEIGHBOUR BEAT EXCLUSIONS\n`shot_context.neighbour_exclusions` lists the full content of the PREVIOUS and NEXT beat.\nThat content is out of scope here. Do not restate, paraphrase, pre-empt or resolve it.\nIf this beat reads as incomplete without it, leave the gap.\n\n## NARRATIVE SEGMENT\n`shot_context.narrative_segment` gives the segment id (prologue, act_1, act_2a, act_2b,\nact_3, epilogue), its position and its absolute time window inside the 510 s narrative\ntimeline. Use it for act context only. It never overrides this beat's shot skeleton,\ntimings or dialogue authority. If `segment_id` is null, this beat has no shot packet:\nderive structure from the beat sheet and stay inside the camera vocabulary.\n\n\n## NEIGHBOUR EXCLUSION SELF-CHECK (mandatory)\nThe last shot of this beat must END BEFORE the first action listed in\n`neighbour_exclusions.next.forbidden_lines`. Physical consequences described there\n(impacts, breakage, discharges, objects coming to rest, positions established there)\nmust not appear in your blocking, SFX or `continuity_delta` - not even as a beginning,\nan implication or an aftermath. Leaving the beat on an unresolved gesture is correct.\n\n## PREVIOUS BEAT: STATE, NOT TRANSITION (mandatory)\nThis beat OPENS in the world-state that the previous beat's transition has ALREADY\nproduced. Anything that `neighbour_exclusions.previous.forbidden_lines` describes as\nstopping, ceasing, cutting out, falling silent, subsiding, being replaced or coming\nto rest happened BEFORE your first frame.\nWrite it as an existing condition (\"the room is lit at standard operational levels\",\n\"only the low hum of safe mode remains\"). Never write it as an event\n(\"the strobing ceases\", \"the alarms cut out\", \"the lights return to normal\") - that\ntransition belongs to the previous beat and is a rejection.\nState changes that originate in THIS beat's own beat_text remain allowed and must be\nstaged normally.\n\n\n## PRESENTATION INTRO BEAT\nIf `shot_context.presentation_intro` is true this beat is a title/presentation\nintro, not narrative canon. It is NOT one of the 44 canonical narrative beats.\n- No diegetic location, no participating characters, no canon facts. Never assert\n  or invent Demian, Y.D., the Villa, factions, history, dialogue or plot events.\n- No spoken dialogue. The only text that may appear is `shot_context.text_cards`,\n  verbatim, in the shot given by `text_cards[].shot_id`. Do not reword, translate,\n  shorten, merge or re-attribute a card.\n- `text_cards[].attribution` is binding. Where it is null the line carries NO\n  author name and NO dash prefix and must never be framed as a quotation.\n- `shot_context.handoff_exception` is the single documented exception to the\n  next-beat exclusion rule: shot 000-06 may crossfade its AUDIO into Harrison\n  Blake's voice-over. No image content, no dialogue line and no documentary\n  material from P10G-BEAT-001 may appear.\n- `continuity_delta` must stay empty or describe tone only. The intro mutates no\n  canon state.\n- The intro runs on a separate 30 s presentation clock. Do not shift, renumber or\n  reinterpret the 510 s narrative timeline or any canonical segment window.\n- `narrative_segment.index` is 0 (pre-roll) with `of` = the six narrative\n  segments. Index 0 is not a seventh segment.\n\n\nINTRO TEXT-STATE CONTRACT (applies only to beat P10G-BEAT-000):\n- Every shot carries text_card_ids, text_state and visible_text_carry_over.\n- text_state=introduce: the shot renders exactly its text_card_ids, verbatim.\n- text_state=hold: the shot introduces NO new text; the cards in visible_text_carry_over stay on screen unchanged. Stating that the held text remains visible is REQUIRED and is NOT an unauthorised-text violation.\n- text_state=destroy: no new text; visible_text_carry_over is torn apart by the glitch.\n- audio.dialogue MUST be null in all six shots. No speech, no narration, no speaker, no character name and no quoted line from any other beat.\n- The hand-off to the next beat is an audio bed cross-fade only; describe it in audio.ambience or audio.sfx, never in audio.dialogue.\n\nINTRO TEXT AUTHORITY (P10G-BEAT-000 only):\n- The ONLY authoritative card text is shot.text_render[].text and shot.text_render[].attribution. These strings are stamped deterministically by the pipeline and are correct by construction.\n- Do NOT compare, retype or judge card text found in prose fields such as blocking, subject or intent. Prose fields are descriptive only. Dash characters, quotation marks and whitespace in prose are NEVER a violation.\n- Report a verbatim violation only if shot.text_render is missi